title;company;location;url;source;salary;employment_type;posted_date;description;date_posted;score;category;applied;interview;notes
Senior Staff Software Engineer, Trust;Airbnb;Remote - US;https://careers.airbnb.com/positions/7818982?gh_jid=7818982;Greenhouse;Not specified;Unknown;Unknown;;;;;;;
Software Engineer, CI Platform Infrastructure;Airbnb;Remote - USA;https://careers.airbnb.com/positions/8077612?gh_jid=8077612;Greenhouse;Not specified;Unknown;Unknown;;;;;;;
Software Engineer, Cloud Networking;Airbnb;Remote - USA or Canada;https://careers.airbnb.com/positions/8037090?gh_jid=8037090;Greenhouse;Not specified;Unknown;Unknown;;;;;;;
Staff Backend Engineer, Host Serving and Access;Airbnb;Remote - USA;https://careers.airbnb.com/positions/8077995?gh_jid=8077995;Greenhouse;Not specified;Unknown;Unknown;;;;;;;
Staff Data Scientist - Long Term Impact;Airbnb;Remote - USA;https://careers.airbnb.com/positions/8042680?gh_jid=8042680;Greenhouse;Not specified;Unknown;Unknown;;;;;;;
Staff Frontend Engineer, Client Data & Networking Platform;Airbnb;Remote - USA;https://careers.airbnb.com/positions/7962101?gh_jid=7962101;Greenhouse;Not specified;Unknown;Unknown;;;;;;;
Staff Full Stack Engineer, Reservations and Additional Products;Airbnb;Remote, USA;https://careers.airbnb.com/positions/7763307?gh_jid=7763307;Greenhouse;Not specified;Unknown;Unknown;;;;;;;
Staff Machine Learning Engineer, Listings and Host Tools Data and AI;Airbnb;Remote-USA;https://careers.airbnb.com/positions/7454348?gh_jid=7454348;Greenhouse;Not specified;Unknown;Unknown;;;;;;;
Staff Platform Manager, Quality;Airbnb;Remote - United States;https://careers.airbnb.com/positions/8060054?gh_jid=8060054;Greenhouse;Not specified;Unknown;Unknown;;;;;;;
Staff Software Engineer, Build (Bazel);Airbnb;Remote - USA;https://careers.airbnb.com/positions/7739337?gh_jid=7739337;Greenhouse;Not specified;Unknown;Unknown;;;;;;;
Staff Software Engineer, Community Support Engineering;Airbnb;Remote - USA;https://careers.airbnb.com/positions/7463421?gh_jid=7463421;Greenhouse;Not specified;Unknown;Unknown;;;;;;;
Staff Web Automation Engineer, Quality Engineering;Airbnb;Brazil - Remote;https://careers.airbnb.com/positions/7380185?gh_jid=7380185;Greenhouse;Not specified;Unknown;Unknown;;;;;;;
Account Development Manager;Precision Medicine Group;Remote;https://remoteOK.com/remote-jobs/remote-account-development-manager-precision-medicine-group-1135149;RemoteOK;Not specified;Unknown;Unknown;;2026-07-21T16:00:55+00:00;;;;;
Job opening 2;Coldwell Banker GB;Urban agglomeration of Montreal,;https://remoteOK.com/remote-jobs/remote-job-opening-2-coldwell-banker-gb-1135209;RemoteOK;Not specified;Unknown;Unknown;;2026-07-21T07:36:23+00:00;;;;;
Job opening 1;Coldwell Banker GB;Urban agglomeration of Montreal,;https://remoteOK.com/remote-jobs/remote-job-opening-1-coldwell-banker-gb-1135210;RemoteOK;Not specified;Unknown;Unknown;;2026-07-21T07:36:22+00:00;;;;;
Freelance Creative Operations Coordinator;Klick;Toronto, Toronto, Ontario, Canada;https://remoteOK.com/remote-jobs/remote-freelance-creative-operations-coordinator-klick-1135143;RemoteOK;Not specified;Unknown;Unknown;;2026-07-20T22:39:44+00:00;;;;;
